No,Keyword,Search Volume,CPC,Paid Difficulty,Search Difficulty
1,"driver for arduino mega 2560",50,"$0",34,16
2,"lcd with arduino mega",30,"$4.08",33,15
3,"esp8266 with arduino mega",30,"$0",56,22
4,"what is arduino mega",30,"$0",24,13
5,"lcd to arduino mega",30,"$4.08",33,15
6,"grbl for arduino mega",10,"$0","00",5
7,"software for arduino mega 2560",10,"$0",67,26
8,"esp8266 to arduino mega",10,"$0","00",5
9,"projects with arduino mega 2560",10,"$1.77",29,14
10,"nodemcu with arduino mega",10,"$0",52,21
11,"bootloader for arduino mega 2560",10,"$0","00",5
12,"esp8266 with arduino mega 2560",10,"$0",57,23
13,"grbl for arduino mega 2560",10,"$0",7,8
14,"arduino mega without headers",10,"$393.24",100,36
15,"programmer for arduino mega 2560",10,"$9.63",94,34
16,"cnc with arduino mega 2560",10,"$1.21",100,36
17,"rfid with arduino mega",10,"$0","00",5
18,"is arduino mega faster than uno",10,"$0","00",5
19,"driver for arduino mega",0,"$0","00","00"
20,"projects for arduino mega 2560",0,"$0","00","00"
21,"nextion to arduino mega",0,"$0","00","00"
22,"nrf24l01 with arduino mega",0,"$0","00","00"
23,"mpu6050 with arduino mega",0,"$0","00","00"
24,"esp8266 to arduino mega connection",0,"$0","00","00"
25,"nodemcu to arduino mega",0,"$0","00","00"
26,"rfid to arduino mega",0,"$0","00","00"
27,"arduino for mega 2560",0,"$0","00","00"
28,"rs232 to arduino mega",0,"$0","00","00"
29,"nrf24l01 to arduino mega",0,"$0","00","00"
30,"rtc to arduino mega",0,"$0","00","00"
31,"introduction to arduino mega",0,"$0","00","00"
32,"nextion with arduino mega",0,"$0","00","00"
33,"programmer for arduino mega",10,"$0",14,10
